question,answer
Unable to make payment via the portal?,"We advise you to consult your bank or use any other card and try the appropriate payment, if nothing works, you can opt for different measures, for assistance reach out to <a href='mailto:help@hpair.org' style='color:#1c1c1c;'>help@hpair.org</a>"
How to plan our travel and accommodation in Delhi?,HPAIR team with time will issue specific guides to refer with the delegates over mail that would contain all the necessary information
How to prepare for the conference,We advise you to research about the speakers and be ready for a challenging yet fun conference for all of you
What is the application selection procedure?,"Every application will go through a 3 step process- Resume shortlisting, Essay questions shortlisting and interview."
How and when will I get to know about my selection? (interview/Application)?,"Over the mail you’ll have the necessary information and you’ll have your decision ready soon after your interview. Everyone who’s either accepted or rejected will hear their decision"